{"$schema":"https://json-schema.org/draft/2020-12/schema","type":"object","required":["schema_version","record_type","id","created_at","campaign_plan_id","action","approval"],"properties":{"schema_version":{"const":"v0.2"},"record_type":{"const":"action_plan"},"id":{"type":"string","minLength":1},"created_at":{"type":"string","pattern":"Z$"},"campaign_plan_id":{"type":"string","minLength":1},"action":{"type":"object","required":["kind","account_id","target","before","after","cost","rollback","verification","campaign_plan_sha256","expected_ui_revision"],"properties":{"kind":{"enum":["create_campaign","edit_campaign","status_change","roles_change","audience_change","catalog_change","bulk_change","configure"]},"account_id":{"type":"string","minLength":1},"target":{"type":"object","required":["resource_type","resource_id"]},"before":{"type":"object"},"after":{"type":"object"},"cost":{"type":"object","required":["currency","maximum_effect"]},"rollback":{"type":"string","minLength":1},"verification":{"type":"object"},"campaign_plan_sha256":{"type":"string","pattern":"^[a-f0-9]{64}$"},"expected_ui_revision":{"type":"string","minLength":1},"campaign_id":{"type":"string"},"budget":{"type":"object"}},"additionalProperties":false},"approval":{"type":"object","required":["decision_id","approved_by","approved_at","expires_at","approved_action_sha256","provenance_notice","decision_sha256"],"properties":{"decision_id":{"type":"string"},"approved_by":{"type":"string"},"approved_at":{"type":"string","pattern":"Z$"},"expires_at":{"type":"string","pattern":"Z$"},"approved_action_sha256":{"type":"string","pattern":"^[a-f0-9]{64}$"},"provenance_notice":{"type":"string"},"decision_sha256":{"type":"string","pattern":"^[a-f0-9]{64}$"}},"additionalProperties":false}}}
